{
  "$schema": "https://json-schema.org/draft/2020-12/schema",
  "$id": "schemas/ai/ai-program.schema.json",
  "title": "Formal AI V2 program",
  "type": "object",
  "required": [
    "schema_version",
    "data_version",
    "id",
    "name",
    "version",
    "status",
    "entry_node_id",
    "nodes",
    "edges",
    "subroutines"
  ],
  "properties": {
    "schema_version": {
      "const": "2.0.0"
    },
    "data_version": {
      "type": "string",
      "minLength": 1
    },
    "id": {
      "type": "string",
      "minLength": 1,
      "pattern": "^AIP-[A-Za-z0-9_.-]+$"
    },
    "name": {
      "type": "string",
      "minLength": 1
    },
    "version": {
      "type": "integer",
      "minimum": 1
    },
    "status": {
      "enum": [
        "draft",
        "valid",
        "invalid",
        "archived"
      ]
    },
    "entry_node_id": {
      "type": "string",
      "minLength": 1
    },
    "nodes": {
      "type": "array",
      "minItems": 1,
      "items": {
        "$ref": "#/$defs/node"
      }
    },
    "edges": {
      "type": "array",
      "items": {
        "$ref": "#/$defs/edge"
      }
    },
    "subroutines": {
      "type": "array",
      "items": {
        "$ref": "#/$defs/subroutine"
      }
    },
    "tags": {
      "type": "array",
      "items": {
        "type": "string",
        "minLength": 1
      },
      "uniqueItems": true
    },
    "description": {
      "type": "string"
    },
    "updated_at": {
      "type": "string",
      "minLength": 1
    },
    "compiled": {
      "type": [
        "object",
        "null"
      ]
    },
    "result_slots": {
      "type": "array",
      "items": {
        "$ref": "#/$defs/result_slot"
      }
    }
  },
  "additionalProperties": false,
  "$defs": {
    "position": {
      "type": "object",
      "required": [
        "x",
        "y"
      ],
      "properties": {
        "x": {
          "type": "number"
        },
        "y": {
          "type": "number"
        }
      },
      "additionalProperties": false
    },
    "endpoint": {
      "type": "object",
      "required": [
        "node_id",
        "port_id"
      ],
      "properties": {
        "node_id": {
          "type": "string",
          "minLength": 1
        },
        "port_id": {
          "type": "string",
          "minLength": 1
        }
      },
      "additionalProperties": false
    },
    "target_selector": {
      "type": "object",
      "required": [
        "selector_id",
        "params"
      ],
      "properties": {
        "selector_id": {
          "type": "string",
          "pattern": "^ATS-[A-Za-z0-9_.-]+$"
        },
        "params": {
          "type": "object"
        }
      },
      "additionalProperties": false
    },
    "predicate_clause": {
      "type": "object",
      "required": [
        "predicate_master_id",
        "params",
        "negate"
      ],
      "properties": {
        "predicate_master_id": {
          "type": "string",
          "pattern": "^AIC-[A-Za-z0-9_.-]+$"
        },
        "params": {
          "type": "object"
        },
        "negate": {
          "type": "boolean"
        }
      },
      "additionalProperties": false
    },
    "predicate_expression": {
      "type": "object",
      "required": [
        "logic",
        "clauses"
      ],
      "properties": {
        "logic": {
          "type": "string",
          "enum": [
            "ALL",
            "ANY"
          ]
        },
        "clauses": {
          "type": "array",
          "minItems": 1,
          "items": {
            "$ref": "#/$defs/predicate_clause"
          }
        }
      },
      "additionalProperties": false
    },
    "node": {
      "type": "object",
      "required": [
        "instance_id",
        "master_node_id",
        "node_type",
        "position",
        "parameters"
      ],
      "properties": {
        "instance_id": {
          "type": "string",
          "minLength": 1
        },
        "master_node_id": {
          "type": "string",
          "minLength": 1,
          "pattern": "^(AIS|AIC|AIA)-[A-Za-z0-9_.-]+$"
        },
        "master_data_version": {
          "type": "string",
          "minLength": 1
        },
        "node_type": {
          "type": "string",
          "enum": [
            "search",
            "condition",
            "action"
          ]
        },
        "position": {
          "$ref": "#/$defs/position"
        },
        "parameters": {
          "type": "object"
        },
        "target_selector": {
          "anyOf": [
            {
              "type": "null"
            },
            {
              "$ref": "#/$defs/target_selector"
            }
          ]
        },
        "comment": {
          "type": "string"
        },
        "target_source": {
          "anyOf": [
            {
              "type": "null"
            },
            {
              "$ref": "#/$defs/target_source"
            }
          ]
        },
        "target_tag_id": {
          "anyOf": [
            {
              "type": "null"
            },
            {
              "type": "string",
              "pattern": "^TAG-[A-Za-z0-9_.-]+$"
            }
          ]
        },
        "target_condition": {
          "anyOf": [
            {
              "type": "null"
            },
            {
              "$ref": "#/$defs/action_target_condition"
            }
          ]
        }
      },
      "allOf": [
        {
          "if": {
            "properties": {
              "node_type": {
                "const": "search"
              }
            }
          },
          "then": {
            "properties": {
              "master_node_id": {
                "pattern": "^AIS-[A-Za-z0-9_.-]+$"
              },
              "parameters": {
                "type": "object",
                "required": [
                  "target_tag_id"
                ],
                "properties": {
                  "target_tag_id": {
                    "type": "string",
                    "pattern": "^TAG-[A-Za-z0-9_.-]+$"
                  },
                  "tag_condition": {
                    "$ref": "#/$defs/tag_condition"
                  },
                  "predicate": {
                    "$ref": "#/$defs/predicate_expression"
                  },
                  "result_slot_id": {
                    "type": "string",
                    "pattern": "^ARS-[A-Za-z0-9_.-]+$"
                  }
                },
                "oneOf": [
                  {
                    "required": [
                      "tag_condition"
                    ],
                    "not": {
                      "required": [
                        "predicate"
                      ]
                    }
                  },
                  {
                    "required": [
                      "predicate"
                    ],
                    "not": {
                      "required": [
                        "tag_condition"
                      ]
                    }
                  }
                ],
                "additionalProperties": false
              },
              "target_selector": {
                "type": "null"
              },
              "target_source": {
                "type": "null"
              },
              "target_tag_id": {
                "type": "null"
              },
              "target_condition": {
                "type": "null"
              }
            }
          }
        },
        {
          "if": {
            "properties": {
              "node_type": {
                "const": "condition"
              }
            }
          },
          "then": {
            "properties": {
              "master_node_id": {
                "pattern": "^AIC-[A-Za-z0-9_.-]+$"
              },
              "parameters": {
                "type": "object",
                "properties": {
                  "tag_condition": {
                    "$ref": "#/$defs/tag_condition"
                  },
                  "subject_scope": {
                    "enum": [
                      "SELF",
                      "BATTLE"
                    ]
                  },
                  "predicate": {
                    "$ref": "#/$defs/predicate_expression"
                  }
                },
                "oneOf": [
                  {
                    "required": [
                      "tag_condition"
                    ],
                    "not": {
                      "anyOf": [
                        {
                          "required": [
                            "subject_scope"
                          ]
                        },
                        {
                          "required": [
                            "predicate"
                          ]
                        }
                      ]
                    }
                  },
                  {
                    "required": [
                      "subject_scope",
                      "predicate"
                    ],
                    "not": {
                      "required": [
                        "tag_condition"
                      ]
                    }
                  }
                ],
                "additionalProperties": false
              },
              "target_selector": {
                "type": "null"
              },
              "target_source": {
                "type": "null"
              },
              "target_tag_id": {
                "type": "null"
              },
              "target_condition": {
                "type": "null"
              }
            }
          }
        },
        {
          "if": {
            "properties": {
              "node_type": {
                "const": "action"
              }
            }
          },
          "then": {
            "properties": {
              "master_node_id": {
                "pattern": "^AIA-[A-Za-z0-9_.-]+$"
              }
            }
          }
        }
      ],
      "additionalProperties": false
    },
    "edge": {
      "type": "object",
      "required": [
        "edge_id",
        "from",
        "transition_kind"
      ],
      "properties": {
        "edge_id": {
          "type": "string",
          "minLength": 1
        },
        "from": {
          "$ref": "#/$defs/endpoint"
        },
        "transition_kind": {
          "enum": [
            "NODE",
            "CALL",
            "RETURN"
          ]
        },
        "to": {
          "$ref": "#/$defs/endpoint"
        },
        "subroutine_id": {
          "type": "string",
          "minLength": 1
        },
        "return_to": {
          "$ref": "#/$defs/endpoint"
        }
      },
      "allOf": [
        {
          "if": {
            "properties": {
              "transition_kind": {
                "const": "NODE"
              }
            }
          },
          "then": {
            "required": [
              "to"
            ],
            "not": {
              "anyOf": [
                {
                  "required": [
                    "subroutine_id"
                  ]
                },
                {
                  "required": [
                    "return_to"
                  ]
                }
              ]
            }
          }
        },
        {
          "if": {
            "properties": {
              "transition_kind": {
                "const": "CALL"
              }
            }
          },
          "then": {
            "required": [
              "subroutine_id",
              "return_to"
            ],
            "not": {
              "required": [
                "to"
              ]
            }
          }
        },
        {
          "if": {
            "properties": {
              "transition_kind": {
                "const": "RETURN"
              }
            }
          },
          "then": {
            "not": {
              "anyOf": [
                {
                  "required": [
                    "to"
                  ]
                },
                {
                  "required": [
                    "subroutine_id"
                  ]
                },
                {
                  "required": [
                    "return_to"
                  ]
                }
              ]
            }
          }
        }
      ],
      "additionalProperties": false
    },
    "subroutine": {
      "type": "object",
      "required": [
        "id",
        "entry_node_id"
      ],
      "properties": {
        "id": {
          "type": "string",
          "minLength": 1
        },
        "entry_node_id": {
          "type": "string",
          "minLength": 1
        }
      },
      "additionalProperties": false
    },
    "result_slot": {
      "type": "object",
      "required": [
        "slot_id",
        "name",
        "value_type"
      ],
      "properties": {
        "slot_id": {
          "type": "string",
          "pattern": "^ARS-[A-Za-z0-9_.-]+$"
        },
        "name": {
          "type": "string",
          "minLength": 1
        },
        "value_type": {
          "const": "UNIT_SET"
        }
      },
      "additionalProperties": false
    },
    "target_source": {
      "type": "object",
      "required": [
        "kind",
        "result_slot_id"
      ],
      "properties": {
        "kind": {
          "const": "SEARCH_RESULT"
        },
        "result_slot_id": {
          "type": "string",
          "pattern": "^ARS-[A-Za-z0-9_.-]+$"
        }
      },
      "additionalProperties": false
    },
    "action_target_condition": {
      "type": "object",
      "required": [
        "tag_id",
        "params"
      ],
      "properties": {
        "tag_id": {
          "type": "string",
          "pattern": "^TAG-[A-Za-z0-9_.-]+$"
        },
        "params": {
          "type": "object"
        }
      },
      "additionalProperties": false
    },
    "tag_condition": {
      "type": "object",
      "required": [
        "tag_id",
        "params"
      ],
      "properties": {
        "tag_id": {
          "type": "string",
          "pattern": "^TAG-[A-Za-z0-9_.-]+$"
        },
        "params": {
          "type": "object"
        }
      },
      "additionalProperties": false
    }
  }
}
