{
  "schema_version": "2.0.0",
  "data_version": "0.1.0-draft",
  "id": "AIP-0001",
  "name": "P1 Schema Sample",
  "version": 1,
  "status": "valid",
  "entry_node_id": "node-search",
  "nodes": [
    {
      "instance_id": "node-search",
      "master_node_id": "AIS-0001",
      "node_type": "search",
      "position": {
        "x": 0,
        "y": 0
      },
      "parameters": {
        "predicate": {
          "logic": "ALL",
          "clauses": [
            {
              "predicate_master_id": "AIC-0001",
              "params": {},
              "negate": false
            }
          ]
        },
        "target_tag_id": "TAG-TARGET-ENEMY"
      }
    },
    {
      "instance_id": "node-state",
      "master_node_id": "AIC-0002",
      "node_type": "condition",
      "position": {
        "x": 2,
        "y": 0
      },
      "parameters": {
        "subject_scope": "SELF",
        "predicate": {
          "logic": "ANY",
          "clauses": [
            {
              "predicate_master_id": "AIC-0002",
              "params": {
                "threshold": 0.5
              },
              "negate": false
            }
          ]
        }
      }
    },
    {
      "instance_id": "node-action",
      "master_node_id": "AIA-0002",
      "node_type": "action",
      "position": {
        "x": 4,
        "y": 0
      },
      "parameters": {
        "skill_id": "SKL-0001"
      },
      "target_selector": {
        "selector_id": "ATS-0001",
        "params": {}
      }
    },
    {
      "instance_id": "node-wait",
      "master_node_id": "AIA-0003",
      "node_type": "action",
      "position": {
        "x": 0,
        "y": 2
      },
      "parameters": {}
    }
  ],
  "edges": [
    {
      "edge_id": "edge-call",
      "from": {
        "node_id": "node-search",
        "port_id": "found"
      },
      "transition_kind": "CALL",
      "subroutine_id": "SUB-1",
      "return_to": {
        "node_id": "node-action",
        "port_id": "in"
      }
    },
    {
      "edge_id": "edge-not-found",
      "from": {
        "node_id": "node-search",
        "port_id": "not_found"
      },
      "transition_kind": "NODE",
      "to": {
        "node_id": "node-wait",
        "port_id": "in"
      }
    },
    {
      "edge_id": "edge-return-yes",
      "from": {
        "node_id": "node-state",
        "port_id": "true"
      },
      "transition_kind": "RETURN"
    },
    {
      "edge_id": "edge-return-no",
      "from": {
        "node_id": "node-state",
        "port_id": "false"
      },
      "transition_kind": "RETURN"
    }
  ],
  "subroutines": [
    {
      "id": "SUB-1",
      "entry_node_id": "node-state"
    }
  ],
  "tags": [
    "p1"
  ]
}
